{
  "$schema": "./component-registry.schema.json",
  "name": "@afenda/shadcn",
  "version": "0.1.0",
  "generatedAt": "2026-02-09T04:40:53.244Z",
  "stats": {
    "primitives": 388,
    "hooks": 7,
    "custom": 16,
    "blocks": 193,
    "total": 604
  },
  "exports": {
    ".": "./src/index.ts",
    "./blocks": "./src/blocks/index.ts",
    "./custom": "./src/custom/index.ts",
    "./hooks": "./src/hooks/index.ts",
    "./lib": "./src/lib/index.ts",
    "./lib/utils": "./src/lib/utils.ts"
  },
  "components": {
    "primitives": [
      {
        "name": "Accordion",
        "path": "./accordion",
        "file": "accordion.tsx",
        "category": "display",
        "kind": "named"
      },
      {
        "name": "AccordionContent",
        "path": "./accordion",
        "file": "accordion.tsx",
        "category": "display",
        "kind": "named"
      },
      {
        "name": "AccordionItem",
        "path": "./accordion",
        "file": "accordion.tsx",
        "category": "display",
        "kind": "named"
      },
      {
        "name": "AccordionTrigger",
        "path": "./accordion",
        "file": "accordion.tsx",
        "category": "display",
        "kind": "named"
      },
      {
        "name": "Alert",
        "path": "./alert",
        "file": "alert.tsx",
        "category": "feedback",
        "kind": "named"
      },
      {
        "name": "AlertDescription",
        "path": "./alert",
        "file": "alert.tsx",
        "category": "feedback",
        "kind": "named"
      },
      {
        "name": "AlertDialog",
        "path": "./alert-dialog",
        "file": "alert-dialog.tsx",
        "category": "feedback",
        "kind": "named"
      },
      {
        "name": "AlertDialogAction",
        "path": "./alert-dialog",
        "file": "alert-dialog.tsx",
        "category": "feedback",
        "kind": "named"
      },
      {
        "name": "AlertDialogCancel",
        "path": "./alert-dialog",
        "file": "alert-dialog.tsx",
        "category": "feedback",
        "kind": "named"
      },
      {
        "name": "AlertDialogContent",
        "path": "./alert-dialog",
        "file": "alert-dialog.tsx",
        "category": "feedback",
        "kind": "named"
      },
      {
        "name": "AlertDialogDescription",
        "path": "./alert-dialog",
        "file": "alert-dialog.tsx",
        "category": "feedback",
        "kind": "named"
      },
      {
        "name": "AlertDialogFooter",
        "path": "./alert-dialog",
        "file": "alert-dialog.tsx",
        "category": "feedback",
        "kind": "named"
      },
      {
        "name": "AlertDialogHeader",
        "path": "./alert-dialog",
        "file": "alert-dialog.tsx",
        "category": "feedback",
        "kind": "named"
      },
      {
        "name": "AlertDialogMedia",
        "path": "./alert-dialog",
        "file": "alert-dialog.tsx",
        "category": "feedback",
        "kind": "named"
      },
      {
        "name": "AlertDialogOverlay",
        "path": "./alert-dialog",
        "file": "alert-dialog.tsx",
        "category": "feedback",
        "kind": "named"
      },
      {
        "name": "AlertDialogPortal",
        "path": "./alert-dialog",
        "file": "alert-dialog.tsx",
        "category": "feedback",
        "kind": "named"
      },
      {
        "name": "AlertDialogTitle",
        "path": "./alert-dialog",
        "file": "alert-dialog.tsx",
        "category": "feedback",
        "kind": "named"
      },
      {
        "name": "AlertDialogTrigger",
        "path": "./alert-dialog",
        "file": "alert-dialog.tsx",
        "category": "feedback",
        "kind": "named"
      },
      {
        "name": "AlertTitle",
        "path": "./alert",
        "file": "alert.tsx",
        "category": "feedback",
        "kind": "named"
      },
      {
        "name": "AppSidebar",
        "path": "./app-sidebar",
        "file": "app-sidebar.tsx",
        "category": "layout",
        "kind": "function"
      },
      {
        "name": "AspectRatio",
        "path": "./aspect-ratio",
        "file": "aspect-ratio.tsx",
        "category": "layout",
        "kind": "named"
      },
      {
        "name": "Avatar",
        "path": "./avatar",
        "file": "avatar.tsx",
        "category": "display",
        "kind": "named"
      },
      {
        "name": "AvatarBadge",
        "path": "./avatar",
        "file": "avatar.tsx",
        "category": "display",
        "kind": "named"
      },
      {
        "name": "AvatarFallback",
        "path": "./avatar",
        "file": "avatar.tsx",
        "category": "display",
        "kind": "named"
      },
      {
        "name": "AvatarGroup",
        "path": "./avatar",
        "file": "avatar.tsx",
        "category": "display",
        "kind": "named"
      },
      {
        "name": "AvatarGroupCount",
        "path": "./avatar",
        "file": "avatar.tsx",
        "category": "display",
        "kind": "named"
      },
      {
        "name": "AvatarImage",
        "path": "./avatar",
        "file": "avatar.tsx",
        "category": "display",
        "kind": "named"
      },
      {
        "name": "Badge",
        "path": "./badge",
        "file": "badge.tsx",
        "category": "display",
        "kind": "named"
      },
      {
        "name": "Breadcrumb",
        "path": "./breadcrumb",
        "file": "breadcrumb.tsx",
        "category": "navigation",
        "kind": "named"
      },
      {
        "name": "BreadcrumbEllipsis",
        "path": "./breadcrumb",
        "file": "breadcrumb.tsx",
        "category": "navigation",
        "kind": "named"
      },
      {
        "name": "BreadcrumbItem",
        "path": "./breadcrumb",
        "file": "breadcrumb.tsx",
        "category": "navigation",
        "kind": "named"
      },
      {
        "name": "BreadcrumbLink",
        "path": "./breadcrumb",
        "file": "breadcrumb.tsx",
        "category": "navigation",
        "kind": "named"
      },
      {
        "name": "BreadcrumbList",
        "path": "./breadcrumb",
        "file": "breadcrumb.tsx",
        "category": "navigation",
        "kind": "named"
      },
      {
        "name": "BreadcrumbPage",
        "path": "./breadcrumb",
        "file": "breadcrumb.tsx",
        "category": "navigation",
        "kind": "named"
      },
      {
        "name": "BreadcrumbSeparator",
        "path": "./breadcrumb",
        "file": "breadcrumb.tsx",
        "category": "layout",
        "kind": "named"
      },
      {
        "name": "Button",
        "path": "./button",
        "file": "button.tsx",
        "category": "action",
        "kind": "named"
      },
      {
        "name": "ButtonGroup",
        "path": "./button-group",
        "file": "button-group.tsx",
        "category": "action",
        "kind": "named"
      },
      {
        "name": "ButtonGroupSeparator",
        "path": "./button-group",
        "file": "button-group.tsx",
        "category": "layout",
        "kind": "named"
      },
      {
        "name": "ButtonGroupText",
        "path": "./button-group",
        "file": "button-group.tsx",
        "category": "action",
        "kind": "named"
      },
      {
        "name": "Calendar",
        "path": "./calendar",
        "file": "calendar.tsx",
        "category": "display",
        "kind": "named"
      },
      {
        "name": "CalendarDayButton",
        "path": "./calendar",
        "file": "calendar.tsx",
        "category": "action",
        "kind": "named"
      },
      {
        "name": "Card",
        "path": "./card",
        "file": "card.tsx",
        "category": "layout",
        "kind": "named"
      },
      {
        "name": "CardAction",
        "path": "./card",
        "file": "card.tsx",
        "category": "layout",
        "kind": "named"
      },
      {
        "name": "CardContent",
        "path": "./card",
        "file": "card.tsx",
        "category": "layout",
        "kind": "named"
      },
      {
        "name": "CardDescription",
        "path": "./card",
        "file": "card.tsx",
        "category": "layout",
        "kind": "named"
      },
      {
        "name": "CardFooter",
        "path": "./card",
        "file": "card.tsx",
        "category": "layout",
        "kind": "named"
      },
      {
        "name": "CardHeader",
        "path": "./card",
        "file": "card.tsx",
        "category": "layout",
        "kind": "named"
      },
      {
        "name": "CardTitle",
        "path": "./card",
        "file": "card.tsx",
        "category": "layout",
        "kind": "named"
      },
      {
        "name": "Carousel",
        "path": "./carousel",
        "file": "carousel.tsx",
        "category": "display",
        "kind": "named"
      },
      {
        "name": "CarouselContent",
        "path": "./carousel",
        "file": "carousel.tsx",
        "category": "display",
        "kind": "named"
      },
      {
        "name": "CarouselItem",
        "path": "./carousel",
        "file": "carousel.tsx",
        "category": "display",
        "kind": "named"
      },
      {
        "name": "CarouselNext",
        "path": "./carousel",
        "file": "carousel.tsx",
        "category": "display",
        "kind": "named"
      },
      {
        "name": "CarouselPrevious",
        "path": "./carousel",
        "file": "carousel.tsx",
        "category": "display",
        "kind": "named"
      },
      {
        "name": "ChartContainer",
        "path": "./chart",
        "file": "chart.tsx",
        "category": "display",
        "kind": "named"
      },
      {
        "name": "ChartLegend",
        "path": "./chart",
        "file": "chart.tsx",
        "category": "display",
        "kind": "named"
      },
      {
        "name": "ChartLegendContent",
        "path": "./chart",
        "file": "chart.tsx",
        "category": "display",
        "kind": "named"
      },
      {